{
  "pack": "snapshot",
  "ticker": "AAPL",
  "fetched_at": "2026-05-01T15:07:55.084976+00:00",
  "company_info": {
    "ticker": "AAPL",
    "fetched_at": "2026-05-01T15:07:54Z",
    "_cache": "miss",
    "symbol": "AAPL",
    "shortName": "Apple Inc.",
    "sector": "Technology",
    "industry": "Consumer Electronics",
    "currency": "USD",
    "regularMarketPrice": 281.865,
    "marketCap": 4138099539968,
    "trailingPE": 35.67911,
    "forwardPE": 29.995882,
    "priceToBook": 46.99316,
    "dividendYield": 0.38,
    "fiftyTwoWeekHigh": 288.62,
    "fiftyTwoWeekLow": 193.25,
    "_provenance": {
      "source": "yfinance (unofficial Yahoo Finance scraper)",
      "source_authority": "Yahoo Finance (unofficial, not endorsed)",
      "data_type": "unofficial_scraper",
      "update_cycle": "near-real-time (15 min delay)",
      "typical_lag": "15 minutes (price) / 1 day (fundamentals)",
      "fetched_at": "2026-05-01T15:07:54Z",
      "reference_period": null,
      "staleness_days": null
    }
  },
  "price_history": {
    "ticker": "AAPL",
    "period": "2y",
    "interval": "1d",
    "fetched_at": "2026-05-01T15:07:55Z",
    "_cache": "miss",
    "data": [
      {
        "date": "2026-04-27",
        "open": 266.09,
        "high": 268.36,
        "low": 265.07,
        "close": 267.61,
        "volume": 41466800
      },
      {
        "date": "2026-04-28",
        "open": 272.34,
        "high": 273.23,
        "low": 268.66,
        "close": 270.71,
        "volume": 40018900
      },
      {
        "date": "2026-04-29",
        "open": 267.55,
        "high": 271.04,
        "low": 267.04,
        "close": 270.17,
        "volume": 30047900
      },
      {
        "date": "2026-04-30",
        "open": 270.5,
        "high": 276.0,
        "low": 268.14,
        "close": 271.35,
        "volume": 90134300
      },
      {
        "date": "2026-05-01",
        "open": 278.94,
        "high": 287.21,
        "low": 278.37,
        "close": 281.865,
        "volume": 36603691
      }
    ],
    "latest_close": 281.865,
    "latest_date": "2026-05-01",
    "rows": 5,
    "_provenance": {
      "source": "yfinance (unofficial Yahoo Finance scraper)",
      "source_authority": "Yahoo Finance (unofficial, not endorsed)",
      "data_type": "unofficial_scraper",
      "update_cycle": "near-real-time (15 min delay)",
      "typical_lag": "15 minutes (price) / 1 day (fundamentals)",
      "fetched_at": "2026-05-01T15:07:55Z",
      "reference_period": "2026-05-01",
      "staleness_days": 0
    }
  },
  "history": [
    {
      "date": "2026-04-27",
      "open": 266.09,
      "high": 268.36,
      "low": 265.07,
      "close": 267.61,
      "volume": 41466800
    },
    {
      "date": "2026-04-28",
      "open": 272.34,
      "high": 273.23,
      "low": 268.66,
      "close": 270.71,
      "volume": 40018900
    },
    {
      "date": "2026-04-29",
      "open": 267.55,
      "high": 271.04,
      "low": 267.04,
      "close": 270.17,
      "volume": 30047900
    },
    {
      "date": "2026-04-30",
      "open": 270.5,
      "high": 276.0,
      "low": 268.14,
      "close": 271.35,
      "volume": 90134300
    },
    {
      "date": "2026-05-01",
      "open": 278.94,
      "high": 287.21,
      "low": 278.37,
      "close": 281.865,
      "volume": 36603691
    }
  ]
}
